# Verify LDM fibers are actually active on both data nodes
include/assert_grep.inc [LDM fibers active in data node 1 log]
include/assert_grep.inc [LDM fibers active in data node 2 log]
# Verify the JB squeeze hook is armed on both data nodes
include/assert_grep.inc [jb squeeze armed in data node 1 log]
include/assert_grep.inc [jb squeeze armed in data node 2 log]
create table t1 (a int primary key) engine=ndb;
create table t2 (a int primary key) engine=ndb;
create procedure do_insert(count int)
begin
set @x = 0;
repeat
insert into t1 values
(@x+0),  (@x+1),  (@x+2),  (@x+3),
(@x+4),  (@x+5),  (@x+6),  (@x+7),
(@x+8),  (@x+9),  (@x+10), (@x+11),
(@x+12), (@x+13), (@x+14), (@x+15),
(@x+16), (@x+17), (@x+18), (@x+19),
(@x+20), (@x+21), (@x+22), (@x+23),
(@x+24), (@x+25), (@x+26), (@x+27),
(@x+28), (@x+29), (@x+30), (@x+31);
set @x = @x + 32;
until @x >= count
end repeat;
end %
begin;
call do_insert(20000);
rollback;
select count(*) from t1;
count(*)
0
begin;
call do_insert(20000);
commit;
select count(*) from t1;
count(*)
20000
begin;
insert into t2 select * from t1;
rollback;
select count(*) from t2;
count(*)
0
begin;
insert into t2 select * from t1;
commit;
select count(*) from t2;
count(*)
20000
begin;
delete from t2;
commit;
begin;
delete from t1;
commit;
select count(*) from t1;
count(*)
0
select count(*) from t2;
count(*)
0
drop procedure do_insert;
drop table t1,t2;
